{
  "schema_version": "1.0.0",
  "registry_version": "1.0.0",
  "subject": "commit:0123456789abcdef0123456789abcdef01234567",
  "status": "verified",
  "requirements": [
    {
      "id": "REQ-001",
      "owner": "project-manager",
      "acceptance_criteria": "Every verified requirement has evidence.",
      "required_evidence_level": "E3",
      "status": "verified",
      "evidence_references": []
    }
  ],
  "prohibited_actions": ["self-certification"],
  "stop_conditions": ["evidence is missing"],
  "approval_boundaries": ["Andre retains final approval"]
}
